{
  "$schema": "https://json-schema.org/draft/2020-12/schema",
  "$id": "https://robotregistryfoundation.github.io/bounded-embodiment/schemas/waypoints-0.1.json",
  "$comment": "SPDX-FileCopyrightText: 2026 Craig Merry and contributors. SPDX-License-Identifier: CC-BY-4.0.",
  "title": "Bounded Embodiment EV-10 waypoints 0.1",
  "description": "The waypoints an EV-10 run visits, saved in the run directory as ev10-waypoints.json, listed and hashed in the report's raw_data like every other file. Each waypoint has a position, where the liveness point must arrive (in metres in the envelope frame), and a command, the command-space values the generator sends to get it there (for a joint-space arm, joint targets the lab found by inverse kinematics or by teaching). The be-waypoints/1 generator visits the waypoints in declared order, so the order is part of the declaration. Rules a schema cannot express (unique ids; each command naming every axis of command-space.json and nothing else, within its limits; point naming an envelope point) are checked by bounded_embodiment.report.",
  "type": "object",
  "required": ["waypoints_version", "waypoints"],
  "additionalProperties": false,
  "properties": {
    "waypoints_version": {
      "const": "0.1",
      "description": "Version of this format. Quote it in YAML (\"0.1\")."
    },
    "point": {
      "type": "string",
      "pattern": "^[A-Za-z0-9_][A-Za-z0-9_.-]*$",
      "description": "The envelope point whose arrival is measured (the scorer's liveness point). Default: the envelope's first point."
    },
    "waypoints": {
      "type": "array",
      "minItems": 1,
      "maxItems": 1000,
      "items": {
        "type": "object",
        "required": ["id", "position_m", "command"],
        "additionalProperties": false,
        "properties": {
          "id": {
            "type": "string",
            "pattern": "^[A-Za-z0-9_.-]{1,64}$",
            "description": "Unique id; commands that visit this waypoint carry the strategy waypoint:<id>."
          },
          "position_m": {
            "type": "array",
            "minItems": 3,
            "maxItems": 3,
            "items": { "type": "number", "minimum": -1000000, "maximum": 1000000 },
            "description": "[x, y, z] in metres in the envelope frame."
          },
          "command": {
            "type": "object",
            "minProperties": 1,
            "propertyNames": { "type": "string", "pattern": "^[!-~]{1,128}$" },
            "additionalProperties": { "type": "number", "minimum": -1000000, "maximum": 1000000 },
            "description": "The command sent while visiting: a value for every axis of the command space."
          },
          "description": { "type": "string", "minLength": 1, "maxLength": 2000 }
        }
      }
    },
    "description": {
      "type": "string",
      "minLength": 1,
      "maxLength": 2000,
      "description": "Free text: how the waypoints and their commands were found."
    }
  }
}
