{
  "waypoints_version": "0.1",
  "point": "tool",
  "description": "TEST-ONLY: four waypoints inside the tool box; the command is the position itself.",
  "waypoints": [
    {
      "id": "a",
      "position_m": [
        0.25,
        -0.05,
        0.15
      ],
      "command": {
        "x": 0.25,
        "y": -0.05,
        "z": 0.15
      }
    },
    {
      "id": "b",
      "position_m": [
        0.35,
        -0.05,
        0.2
      ],
      "command": {
        "x": 0.35,
        "y": -0.05,
        "z": 0.2
      }
    },
    {
      "id": "c",
      "position_m": [
        0.35,
        0.05,
        0.15
      ],
      "command": {
        "x": 0.35,
        "y": 0.05,
        "z": 0.15
      }
    },
    {
      "id": "d",
      "position_m": [
        0.25,
        0.05,
        0.2
      ],
      "command": {
        "x": 0.25,
        "y": 0.05,
        "z": 0.2
      }
    },
    {
      "id": "e",
      "position_m": [
        0.3,
        0.0,
        0.25
      ],
      "command": {
        "x": 0.3,
        "y": 0.0,
        "z": 0.25
      }
    }
  ]
}
